20:33:34.787237 IP shane-VirtualBox.53306 > www.xjtu.edu.cn.www: Flags [S], seq 579629789, win 5840, options [mss 1460,sackOK,TS val 608550 ecr 0,nop,wscale 5], length 0
20:33:34.817792 IP www.xjtu.edu.cn.www > shane-VirtualBox.53306: Flags [S.], seq 91520001, ack 579629790, win 65535, options [mss 1460], length 0
20:33:34.817820 IP shane-VirtualBox.53306 > www.xjtu.edu.cn.www: Flags [.], ack 1, win 5840, length 0
20:33:34.818179 IP shane-VirtualBox.53306 > www.xjtu.edu.cn.www: Flags [P.], seq 1:289, ack 1, win 5840, length 288
20:33:34.818463 IP www.xjtu.edu.cn.www > shane-VirtualBox.53306: Flags [.], ack 289, win 65535, length 0
20:33:34.846357 IP www.xjtu.edu.cn.www > shane-VirtualBox.53306: Flags [.], seq 1:1421, ack 289, win 65535, length 1420
20:33:34.846383 IP shane-VirtualBox.53306 > www.xjtu.edu.cn.www: Flags [.], ack 1421, win 8520, length 0
20:33:34.846522 IP www.xjtu.edu.cn.www > shane-VirtualBox.53306: Flags [P.], seq 1421:1461, ack 289, win 65535, length 40
20:33:34.846529 IP shane-VirtualBox.53306 > www.xjtu.edu.cn.www: Flags [.], ack 1461, win 8520, length 0
20:33:34.846552 IP www.xjtu.edu.cn.www > shane-VirtualBox.53306: Flags [.], seq 1461:2881, ack 289, win 65535, length 1420
20:33:34.846556 IP shane-VirtualBox.53306 > www.xjtu.edu.cn.www: Flags [.], ack 2881, win 11360, length 0
20:33:34.846638 IP www.xjtu.edu.cn.www > shane-VirtualBox.53306: Flags [.], seq 2881:4301, ack 289, win 65535, length 1420
20:33:34.846644 IP shane-VirtualBox.53306 > www.xjtu.edu.cn.www: Flags [.], ack 4301, win 14200, length 0
20:33:34.846665 IP www.xjtu.edu.cn.www > shane-VirtualBox.53306: Flags [.], seq 4301:5721, ack 289, win 65535, length 1420
20:33:34.846669 IP shane-VirtualBox.53306 > www.xjtu.edu.cn.www: Flags [.], ack 5721, win 17040, length 0
20:33:34.846687 IP www.xjtu.edu.cn.www > shane-VirtualBox.53306: Flags [FP.], seq 5721:6096, ack 289, win 65535, length 375
20:33:34.847042 IP shane-VirtualBox.53306 > www.xjtu.edu.cn.www: Flags [F.], seq 289, ack 6097, win 19880, length 0
20:33:34.847314 IP www.xjtu.edu.cn.www > shane-VirtualBox.53306: Flags [.], ack 290, win 65535, length 0
20:33:34.867886 IP shane-VirtualBox.53307 > www.xjtu.edu.cn.www: Flags [S], seq 312259677, win 5840, options [mss 1460,sackOK,TS val 608570 ecr 0,nop,wscale 5], length 0
20:33:34.867895 IP shane-VirtualBox.53308 > www.xjtu.edu.cn.www: Flags [S], seq 1128446660, win 5840, options [mss 1460,sackOK,TS val 608571 ecr 0,nop,wscale 5], length 0
20:33:34.868130 IP shane-VirtualBox.53309 > www.xjtu.edu.cn.www: Flags [S], seq 85027626, win 5840, options [mss 1460,sackOK,TS val 608571 ecr 0,nop,wscale 5], length 0
20:33:34.868318 IP shane-VirtualBox.53310 > www.xjtu.edu.cn.www: Flags [S], seq 2934874897, win 5840, options [mss 1460,sackOK,TS val 608571 ecr 0,nop,wscale 5], length 0
20:33:34.868505 IP shane-VirtualBox.53311 > www.xjtu.edu.cn.www: Flags [S], seq 3634723682, win 5840, options [mss 1460,sackOK,TS val 608571 ecr 0,nop,wscale 5], length 0
20:33:34.868691 IP shane-VirtualBox.53312 > www.xjtu.edu.cn.www: Flags [S], seq 3941161488, win 5840, options [mss 1460,sackOK,TS val 608571 ecr 0,nop,wscale 5], length 0
20:33:34.938430 IP www.xjtu.edu.cn.www > shane-VirtualBox.53308: Flags [S.], seq 91584001, ack 1128446661, win 65535, options [mss 1460], length 0
20:33:34.938461 IP shane-VirtualBox.53308 > www.xjtu.edu.cn.www: Flags [.], ack 1, win 5840, length 0
20:33:34.938861 IP shane-VirtualBox.53308 > www.xjtu.edu.cn.www: Flags [P.], seq 1:271, ack 1, win 5840, length 270
20:33:34.939285 IP www.xjtu.edu.cn.www > shane-VirtualBox.53308: Flags [.], ack 271, win 65535, length 0
20:33:34.943485 IP www.xjtu.edu.cn.www > shane-VirtualBox.53312: Flags [S.], seq 91648001, ack 3941161489, win 65535, options [mss 1460], length 0
20:33:34.943506 IP shane-VirtualBox.53312 > www.xjtu.edu.cn.www: Flags [.], ack 1, win 5840, length 0
20:33:34.943541 IP www.xjtu.edu.cn.www > shane-VirtualBox.53311: Flags [S.], seq 91712001, ack 3634723683, win 65535, options [mss 1460], length 0
20:33:34.943547 IP shane-VirtualBox.53311 > www.xjtu.edu.cn.www: Flags [.], ack 1, win 5840, length 0
20:33:34.943594 IP www.xjtu.edu.cn.www > shane-VirtualBox.53310: Flags [S.], seq 91776001, ack 2934874898, win 65535, options [mss 1460], length 0
20:33:34.943605 IP shane-VirtualBox.53310 > www.xjtu.edu.cn.www: Flags [.], ack 1, win 5840, length 0
20:33:34.943628 IP www.xjtu.edu.cn.www > shane-VirtualBox.53309: Flags [S.], seq 91840001, ack 85027627, win 65535, options [mss 1460], length 0
20:33:34.943633 IP shane-VirtualBox.53309 > www.xjtu.edu.cn.www: Flags [.], ack 1, win 5840, length 0
20:33:34.943651 IP www.xjtu.edu.cn.www > shane-VirtualBox.53307: Flags [S.], seq 91904001, ack 312259678, win 65535, options [mss 1460], length 0
20:33:34.943656 IP shane-VirtualBox.53307 > www.xjtu.edu.cn.www: Flags [.], ack 1, win 5840, length 0
20:33:34.944369 IP shane-VirtualBox.53307 > www.xjtu.edu.cn.www: Flags [P.], seq 1:295, ack 1, win 5840, length 294
20:33:34.944461 IP shane-VirtualBox.53309 > www.xjtu.edu.cn.www: Flags [P.], seq 1:288, ack 1, win 5840, length 287
20:33:34.944534 IP shane-VirtualBox.53310 > www.xjtu.edu.cn.www: Flags [P.], seq 1:279, ack 1, win 5840, length 278
20:33:34.944610 IP shane-VirtualBox.53311 > www.xjtu.edu.cn.www: Flags [P.], seq 1:279, ack 1, win 5840, length 278
20:33:34.944683 IP shane-VirtualBox.53312 > www.xjtu.edu.cn.www: Flags [P.], seq 1:278, ack 1, win 5840, length 277
20:33:34.945251 IP www.xjtu.edu.cn.www > shane-VirtualBox.53307: Flags [.], ack 295, win 65535, length 0
20:33:34.945264 IP www.xjtu.edu.cn.www > shane-VirtualBox.53309: Flags [.], ack 288, win 65535, length 0
20:33:34.945356 IP www.xjtu.edu.cn.www > shane-VirtualBox.53310: Flags [.], ack 279, win 65535, length 0
20:33:34.945360 IP www.xjtu.edu.cn.www > shane-VirtualBox.53311: Flags [.], ack 279, win 65535, length 0
20:33:34.945362 IP www.xjtu.edu.cn.www > shane-VirtualBox.53312: Flags [.], ack 278, win 65535, length 0
20:33:34.996677 IP www.xjtu.edu.cn.www > shane-VirtualBox.53308: Flags [P.], seq 1:389, ack 271, win 65535, length 388
20:33:34.996738 IP shane-VirtualBox.53308 > www.xjtu.edu.cn.www: Flags [.], ack 389, win 6432, length 0
20:33:34.996884 IP www.xjtu.edu.cn.www > shane-VirtualBox.53308: Flags [F.], seq 389, ack 271, win 65535, length 0
20:33:34.996892 IP www.xjtu.edu.cn.www > shane-VirtualBox.53307: Flags [.], seq 1:1421, ack 295, win 65535, length 1420
20:33:34.996898 IP shane-VirtualBox.53307 > www.xjtu.edu.cn.www: Flags [.], ack 1421, win 8520, length 0
20:33:34.996924 IP www.xjtu.edu.cn.www > shane-VirtualBox.53307: Flags [.], seq 1421:2841, ack 295, win 65535, length 1420
20:33:34.996928 IP shane-VirtualBox.53307 > www.xjtu.edu.cn.www: Flags [.], ack 2841, win 11360, length 0
20:33:34.997284 IP www.xjtu.edu.cn.www > shane-VirtualBox.53307: Flags [.], seq 2841:4261, ack 295, win 65535, length 1420
20:33:34.997294 IP shane-VirtualBox.53307 > www.xjtu.edu.cn.www: Flags [.], ack 4261, win 14200, length 0
20:33:34.997316 IP www.xjtu.edu.cn.www > shane-VirtualBox.53307: Flags [.], seq 4261:5681, ack 295, win 65535, length 1420
20:33:34.997320 IP shane-VirtualBox.53307 > www.xjtu.edu.cn.www: Flags [.], ack 5681, win 17040, length 0
20:33:34.997432 IP www.xjtu.edu.cn.www > shane-VirtualBox.53307: Flags [.], seq 5681:7101, ack 295, win 65535, length 1420
20:33:34.997437 IP shane-VirtualBox.53307 > www.xjtu.edu.cn.www: Flags [.], ack 7101, win 19880, length 0
20:33:34.997455 IP www.xjtu.edu.cn.www > shane-VirtualBox.53307: Flags [FP.], seq 7101:8472, ack 295, win 65535, length 1371
20:33:34.997548 IP www.xjtu.edu.cn.www > shane-VirtualBox.53310: Flags [P.], seq 1:1203, ack 279, win 65535, length 1202
20:33:34.997553 IP shane-VirtualBox.53310 > www.xjtu.edu.cn.www: Flags [.], ack 1203, win 7212, length 0
20:33:34.997572 IP www.xjtu.edu.cn.www > shane-VirtualBox.53309: Flags [P.], seq 1:406, ack 288, win 65535, length 405
20:33:34.997576 IP shane-VirtualBox.53309 > www.xjtu.edu.cn.www: Flags [.], ack 406, win 6432, length 0
20:33:34.997705 IP www.xjtu.edu.cn.www > shane-VirtualBox.53309: Flags [F.], seq 406, ack 288, win 65535, length 0
20:33:34.997710 IP www.xjtu.edu.cn.www > shane-VirtualBox.53310: Flags [F.], seq 1203, ack 279, win 65535, length 0
20:33:34.997813 IP shane-VirtualBox.53307 > www.xjtu.edu.cn.www: Flags [F.], seq 295, ack 8473, win 22720, length 0
20:33:34.997976 IP shane-VirtualBox.53308 > www.xjtu.edu.cn.www: Flags [F.], seq 271, ack 390, win 6432, length 0
20:33:34.998109 IP shane-VirtualBox.53309 > www.xjtu.edu.cn.www: Flags [F.], seq 288, ack 407, win 6432, length 0
20:33:34.998184 IP shane-VirtualBox.53310 > www.xjtu.edu.cn.www: Flags [F.], seq 279, ack 1204, win 7212, length 0
20:33:34.998312 IP shane-VirtualBox.53313 > www.xjtu.edu.cn.www: Flags [S], seq 1409071087, win 5840, options [mss 1460,sackOK,TS val 608603 ecr 0,nop,wscale 5], length 0
20:33:34.998401 IP shane-VirtualBox.53314 > www.xjtu.edu.cn.www: Flags [S], seq 2829061291, win 5840, options [mss 1460,sackOK,TS val 608603 ecr 0,nop,wscale 5], length 0
20:33:34.998487 IP shane-VirtualBox.53315 > www.xjtu.edu.cn.www: Flags [S], seq 2823389238, win 5840, options [mss 1460,sackOK,TS val 608603 ecr 0,nop,wscale 5], length 0
20:33:34.998572 IP shane-VirtualBox.53316 > www.xjtu.edu.cn.www: Flags [S], seq 2878495037, win 5840, options [mss 1460,sackOK,TS val 608603 ecr 0,nop,wscale 5], length 0
20:33:34.999217 IP www.xjtu.edu.cn.www > shane-VirtualBox.53307: Flags [.], ack 296, win 65535, length 0
20:33:34.999236 IP www.xjtu.edu.cn.www > shane-VirtualBox.53308: Flags [.], ack 272, win 65535, length 0
20:33:34.999332 IP www.xjtu.edu.cn.www > shane-VirtualBox.53309: Flags [.], ack 289, win 65535, length 0
20:33:34.999338 IP www.xjtu.edu.cn.www > shane-VirtualBox.53310: Flags [.], ack 280, win 65535, length 0
20:33:35.023882 IP www.xjtu.edu.cn.www > shane-VirtualBox.53311: Flags [P.], seq 1:1229, ack 279, win 65535, length 1228
20:33:35.023901 IP shane-VirtualBox.53311 > www.xjtu.edu.cn.www: Flags [.], ack 1229, win 7368, length 0
20:33:35.023936 IP www.xjtu.edu.cn.www > shane-VirtualBox.53311: Flags [F.], seq 1229, ack 279, win 65535, length 0
20:33:35.023943 IP www.xjtu.edu.cn.www > shane-VirtualBox.53312: Flags [P.], seq 1:954, ack 278, win 65535, length 953
20:33:35.023947 IP shane-VirtualBox.53312 > www.xjtu.edu.cn.www: Flags [.], ack 954, win 7624, length 0
20:33:35.023967 IP www.xjtu.edu.cn.www > shane-VirtualBox.53312: Flags [F.], seq 954, ack 278, win 65535, length 0
20:33:35.024401 IP shane-VirtualBox.53311 > www.xjtu.edu.cn.www: Flags [F.], seq 279, ack 1230, win 7368, length 0
20:33:35.024496 IP shane-VirtualBox.53312 > www.xjtu.edu.cn.www: Flags [F.], seq 278, ack 955, win 7624, length 0
20:33:35.024633 IP shane-VirtualBox.53317 > www.xjtu.edu.cn.www: Flags [S], seq 342896448, win 5840, options [mss 1460,sackOK,TS val 608610 ecr 0,nop,wscale 5], length 0
20:33:35.024744 IP shane-VirtualBox.53318 > www.xjtu.edu.cn.www: Flags [S], seq 1226909045, win 5840, options [mss 1460,sackOK,TS val 608610 ecr 0,nop,wscale 5], length 0
20:33:35.025819 IP www.xjtu.edu.cn.www > shane-VirtualBox.53311: Flags [.], ack 280, win 65535, length 0
20:33:35.025846 IP www.xjtu.edu.cn.www > shane-VirtualBox.53312: Flags [.], ack 279, win 65535, length 0
20:33:35.034806 IP www.xjtu.edu.cn.www > shane-VirtualBox.53314: Flags [S.], seq 92032001, ack 2829061292, win 65535, options [mss 1460], length 0
20:33:35.034831 IP shane-VirtualBox.53314 > www.xjtu.edu.cn.www: Flags [.], ack 1, win 5840, length 0
20:33:35.034864 IP www.xjtu.edu.cn.www > shane-VirtualBox.53313: Flags [S.], seq 92096001, ack 1409071088, win 65535, options [mss 1460], length 0
20:33:35.034870 IP shane-VirtualBox.53313 > www.xjtu.edu.cn.www: Flags [.], ack 1, win 5840, length 0
20:33:35.035026 IP www.xjtu.edu.cn.www > shane-VirtualBox.53316: Flags [S.], seq 92160001, ack 2878495038, win 65535, options [mss 1460], length 0
20:33:35.035044 IP shane-VirtualBox.53316 > www.xjtu.edu.cn.www: Flags [.], ack 1, win 5840, length 0
20:33:35.035158 IP www.xjtu.edu.cn.www > shane-VirtualBox.53315: Flags [S.], seq 92224001, ack 2823389239, win 65535, options [mss 1460], length 0
20:33:35.035165 IP shane-VirtualBox.53315 > www.xjtu.edu.cn.www: Flags [.], ack 1, win 5840, length 0
20:33:35.035386 IP shane-VirtualBox.53315 > www.xjtu.edu.cn.www: Flags [P.], seq 1:277, ack 1, win 5840, length 276
20:33:35.035488 IP shane-VirtualBox.53316 > www.xjtu.edu.cn.www: Flags [P.], seq 1:273, ack 1, win 5840, length 272
20:33:35.035591 IP shane-VirtualBox.53313 > www.xjtu.edu.cn.www: Flags [P.], seq 1:279, ack 1, win 5840, length 278
20:33:35.035668 IP shane-VirtualBox.53314 > www.xjtu.edu.cn.www: Flags [P.], seq 1:272, ack 1, win 5840, length 271
20:33:35.036047 IP www.xjtu.edu.cn.www > shane-VirtualBox.53315: Flags [.], ack 277, win 65535, length 0
20:33:35.036056 IP www.xjtu.edu.cn.www > shane-VirtualBox.53316: Flags [.], ack 273, win 65535, length 0
20:33:35.036105 IP www.xjtu.edu.cn.www > shane-VirtualBox.53313: Flags [.], ack 279, win 65535, length 0
20:33:35.036109 IP www.xjtu.edu.cn.www > shane-VirtualBox.53314: Flags [.], ack 272, win 65535, length 0
20:33:35.037700 IP www.xjtu.edu.cn.www > shane-VirtualBox.53317: Flags [S.], seq 92288001, ack 342896449, win 65535, options [mss 1460], length 0
20:33:35.037718 IP shane-VirtualBox.53317 > www.xjtu.edu.cn.www: Flags [.], ack 1, win 5840, length 0
20:33:35.037745 IP www.xjtu.edu.cn.www > shane-VirtualBox.53318: Flags [S.], seq 92352001, ack 1226909046, win 65535, options [mss 1460], length 0
20:33:35.037751 IP shane-VirtualBox.53318 > www.xjtu.edu.cn.www: Flags [.], ack 1, win 5840, length 0
20:33:35.037967 IP shane-VirtualBox.53317 > www.xjtu.edu.cn.www: Flags [P.], seq 1:274, ack 1, win 5840, length 273
20:33:35.038061 IP shane-VirtualBox.53318 > www.xjtu.edu.cn.www: Flags [P.], seq 1:274, ack 1, win 5840, length 273
20:33:35.038313 IP www.xjtu.edu.cn.www > shane-VirtualBox.53317: Flags [.], ack 274, win 65535, length 0
20:33:35.038373 IP www.xjtu.edu.cn.www > shane-VirtualBox.53318: Flags [.], ack 274, win 65535, length 0
20:33:35.046951 IP www.xjtu.edu.cn.www > shane-VirtualBox.53316: Flags [P.], seq 1:1160, ack 273, win 65535, length 1159
20:33:35.046985 IP shane-VirtualBox.53316 > www.xjtu.edu.cn.www: Flags [.], ack 1160, win 8113, length 0
20:33:35.047159 IP www.xjtu.edu.cn.www > shane-VirtualBox.53315: Flags [P.], seq 1:1133, ack 277, win 65535, length 1132
20:33:35.047166 IP shane-VirtualBox.53315 > www.xjtu.edu.cn.www: Flags [.], ack 1133, win 7924, length 0
20:33:35.047191 IP www.xjtu.edu.cn.www > shane-VirtualBox.53315: Flags [F.], seq 1133, ack 277, win 65535, length 0
20:33:35.047198 IP www.xjtu.edu.cn.www > shane-VirtualBox.53313: Flags [.], seq 1:1421, ack 279, win 65535, length 1420
20:33:35.047202 IP shane-VirtualBox.53313 > www.xjtu.edu.cn.www: Flags [.], ack 1421, win 8520, length 0
20:33:35.047220 IP www.xjtu.edu.cn.www > shane-VirtualBox.53313: Flags [.], seq 1421:2841, ack 279, win 65535, length 1420
20:33:35.047225 IP shane-VirtualBox.53313 > www.xjtu.edu.cn.www: Flags [.], ack 2841, win 11360, length 0
20:33:35.047243 IP www.xjtu.edu.cn.www > shane-VirtualBox.53316: Flags [F.], seq 1160, ack 273, win 65535, length 0
20:33:35.047416 IP www.xjtu.edu.cn.www > shane-VirtualBox.53313: Flags [.], seq 2841:4261, ack 279, win 65535, length 1420
20:33:35.047423 IP shane-VirtualBox.53313 > www.xjtu.edu.cn.www: Flags [.], ack 4261, win 14200, length 0
20:33:35.047442 IP www.xjtu.edu.cn.www > shane-VirtualBox.53313: Flags [P.], seq 4261:4381, ack 279, win 65535, length 120
20:33:35.047446 IP shane-VirtualBox.53313 > www.xjtu.edu.cn.www: Flags [.], ack 4381, win 14200, length 0
20:33:35.047581 IP www.xjtu.edu.cn.www > shane-VirtualBox.53313: Flags [.], seq 4381:5801, ack 279, win 65535, length 1420
20:33:35.047586 IP shane-VirtualBox.53313 > www.xjtu.edu.cn.www: Flags [.], ack 5801, win 17040, length 0
20:33:35.047605 IP www.xjtu.edu.cn.www > shane-VirtualBox.53313: Flags [.], seq 5801:7221, ack 279, win 65535, length 1420
20:33:35.047610 IP shane-VirtualBox.53313 > www.xjtu.edu.cn.www: Flags [.], ack 7221, win 19880, length 0
20:33:35.047627 IP www.xjtu.edu.cn.www > shane-VirtualBox.53313: Flags [.], seq 7221:8641, ack 279, win 65535, length 1420
20:33:35.047631 IP shane-VirtualBox.53313 > www.xjtu.edu.cn.www: Flags [.], ack 8641, win 22720, length 0
20:33:35.047750 IP www.xjtu.edu.cn.www > shane-VirtualBox.53313: Flags [P.], seq 8641:8761, ack 279, win 65535, length 120
20:33:35.048166 IP shane-VirtualBox.53313 > www.xjtu.edu.cn.www: Flags [.], ack 8761, win 22720, length 0
20:33:35.048301 IP shane-VirtualBox.53315 > www.xjtu.edu.cn.www: Flags [F.], seq 277, ack 1134, win 7924, length 0
20:33:35.048394 IP shane-VirtualBox.53316 > www.xjtu.edu.cn.www: Flags [F.], seq 273, ack 1161, win 8113, length 0
20:33:35.048591 IP www.xjtu.edu.cn.www > shane-VirtualBox.53315: Flags [.], ack 278, win 65535, length 0
20:33:35.048628 IP shane-VirtualBox.53319 > www.xjtu.edu.cn.www: Flags [S], seq 269220028, win 5840, options [mss 1460,sackOK,TS val 608616 ecr 0,nop,wscale 5], length 0
20:33:35.048683 IP www.xjtu.edu.cn.www > shane-VirtualBox.53316: Flags [.], ack 274, win 65535, length 0
20:33:35.048741 IP shane-VirtualBox.53320 > www.xjtu.edu.cn.www: Flags [S], seq 261001969, win 5840, options [mss 1460,sackOK,TS val 608616 ecr 0,nop,wscale 5], length 0
20:33:35.048828 IP shane-VirtualBox.53321 > www.xjtu.edu.cn.www: Flags [S], seq 2584802092, win 5840, options [mss 1460,sackOK,TS val 608616 ecr 0,nop,wscale 5], length 0
20:33:35.058512 IP www.xjtu.edu.cn.www > shane-VirtualBox.53313: Flags [.], seq 8761:10181, ack 279, win 65535, length 1420
20:33:35.058529 IP shane-VirtualBox.53313 > www.xjtu.edu.cn.www: Flags [.], ack 10181, win 25560, length 0
20:33:35.059202 IP www.xjtu.edu.cn.www > shane-VirtualBox.53313: Flags [.], seq 10181:11601, ack 279, win 65535, length 1420
20:33:35.059212 IP shane-VirtualBox.53313 > www.xjtu.edu.cn.www: Flags [.], ack 11601, win 28400, length 0
20:33:35.059238 IP www.xjtu.edu.cn.www > shane-VirtualBox.53313: Flags [.], seq 11601:13021, ack 279, win 65535, length 1420
20:33:35.059242 IP shane-VirtualBox.53313 > www.xjtu.edu.cn.www: Flags [.], ack 13021, win 31240, length 0
20:33:35.059260 IP www.xjtu.edu.cn.www > shane-VirtualBox.53313: Flags [P.], seq 13021:13454, ack 279, win 65535, length 433
20:33:35.059264 IP shane-VirtualBox.53313 > www.xjtu.edu.cn.www: Flags [.], ack 13454, win 34080, length 0
20:33:35.059281 IP www.xjtu.edu.cn.www > shane-VirtualBox.53313: Flags [F.], seq 13454, ack 279, win 65535, length 0
20:33:35.059287 IP www.xjtu.edu.cn.www > shane-VirtualBox.53314: Flags [.], seq 1:1421, ack 272, win 65535, length 1420
20:33:35.059291 IP shane-VirtualBox.53314 > www.xjtu.edu.cn.www: Flags [.], ack 1421, win 8520, length 0
20:33:35.059309 IP www.xjtu.edu.cn.www > shane-VirtualBox.53314: Flags [P.], seq 1421:2638, ack 272, win 65535, length 1217
20:33:35.059313 IP shane-VirtualBox.53314 > www.xjtu.edu.cn.www: Flags [.], ack 2638, win 11360, length 0
20:33:35.059330 IP www.xjtu.edu.cn.www > shane-VirtualBox.53314: Flags [F.], seq 2638, ack 272, win 65535, length 0
20:33:35.059556 IP shane-VirtualBox.53313 > www.xjtu.edu.cn.www: Flags [F.], seq 279, ack 13455, win 34080, length 0
20:33:35.059669 IP shane-VirtualBox.53314 > www.xjtu.edu.cn.www: Flags [F.], seq 272, ack 2639, win 11360, length 0
20:33:35.059809 IP shane-VirtualBox.53322 > www.xjtu.edu.cn.www: Flags [S], seq 3887471127, win 5840, options [mss 1460,sackOK,TS val 608619 ecr 0,nop,wscale 5], length 0
20:33:35.060188 IP www.xjtu.edu.cn.www > shane-VirtualBox.53313: Flags [.], ack 280, win 65535, length 0
20:33:35.060203 IP www.xjtu.edu.cn.www > shane-VirtualBox.53314: Flags [.], ack 273, win 65535, length 0
20:33:35.064628 IP www.xjtu.edu.cn.www > shane-VirtualBox.53317: Flags [.], seq 1:1421, ack 274, win 65535, length 1420
20:33:35.064662 IP shane-VirtualBox.53317 > www.xjtu.edu.cn.www: Flags [.], ack 1421, win 8520, length 0
20:33:35.064814 IP www.xjtu.edu.cn.www > shane-VirtualBox.53317: Flags [P.], seq 1421:2769, ack 274, win 65535, length 1348
20:33:35.064821 IP shane-VirtualBox.53317 > www.xjtu.edu.cn.www: Flags [.], ack 2769, win 11360, length 0
20:33:35.064846 IP www.xjtu.edu.cn.www > shane-VirtualBox.53317: Flags [F.], seq 2769, ack 274, win 65535, length 0
20:33:35.064853 IP www.xjtu.edu.cn.www > shane-VirtualBox.53318: Flags [.], seq 1:1421, ack 274, win 65535, length 1420
20:33:35.064857 IP shane-VirtualBox.53318 > www.xjtu.edu.cn.www: Flags [.], ack 1421, win 8520, length 0
20:33:35.064876 IP www.xjtu.edu.cn.www > shane-VirtualBox.53318: Flags [P.], seq 1421:1461, ack 274, win 65535, length 40
20:33:35.064880 IP shane-VirtualBox.53318 > www.xjtu.edu.cn.www: Flags [.], ack 1461, win 8520, length 0
20:33:35.065383 IP shane-VirtualBox.53317 > www.xjtu.edu.cn.www: Flags [F.], seq 274, ack 2770, win 11360, length 0
20:33:35.065541 IP shane-VirtualBox.53323 > www.xjtu.edu.cn.www: Flags [S], seq 3185278957, win 5840, options [mss 1460,sackOK,TS val 608620 ecr 0,nop,wscale 5], length 0
20:33:35.065636 IP shane-VirtualBox.53324 > www.xjtu.edu.cn.www: Flags [S], seq 2410941023, win 5840, options [mss 1460,sackOK,TS val 608620 ecr 0,nop,wscale 5], length 0
20:33:35.066114 IP www.xjtu.edu.cn.www > shane-VirtualBox.53317: Flags [.], ack 275, win 65535, length 0
20:33:35.068032 IP www.xjtu.edu.cn.www > shane-VirtualBox.53318: Flags [P.], seq 1461:1626, ack 274, win 65535, length 165
20:33:35.068055 IP shane-VirtualBox.53318 > www.xjtu.edu.cn.www: Flags [.], ack 1626, win 11360, length 0
20:33:35.068301 IP www.xjtu.edu.cn.www > shane-VirtualBox.53318: Flags [F.], seq 1626, ack 274, win 65535, length 0
20:33:35.068310 IP www.xjtu.edu.cn.www > shane-VirtualBox.53321: Flags [S.], seq 92416001, ack 2584802093, win 65535, options [mss 1460], length 0
20:33:35.068321 IP shane-VirtualBox.53321 > www.xjtu.edu.cn.www: Flags [.], ack 1, win 5840, length 0
20:33:35.068470 IP www.xjtu.edu.cn.www > shane-VirtualBox.53320: Flags [S.], seq 92480001, ack 261001970, win 65535, options [mss 1460], length 0
20:33:35.068482 IP shane-VirtualBox.53320 > www.xjtu.edu.cn.www: Flags [.], ack 1, win 5840, length 0
20:33:35.068522 IP www.xjtu.edu.cn.www > shane-VirtualBox.53319: Flags [S.], seq 92544001, ack 269220029, win 65535, options [mss 1460], length 0
20:33:35.068530 IP shane-VirtualBox.53319 > www.xjtu.edu.cn.www: Flags [.], ack 1, win 5840, length 0
20:33:35.068554 IP www.xjtu.edu.cn.www > shane-VirtualBox.53322: Flags [S.], seq 92608001, ack 3887471128, win 65535, options [mss 1460], length 0
20:33:35.068560 IP shane-VirtualBox.53322 > www.xjtu.edu.cn.www: Flags [.], ack 1, win 5840, length 0
20:33:35.068911 IP shane-VirtualBox.53318 > www.xjtu.edu.cn.www: Flags [F.], seq 274, ack 1627, win 11360, length 0
20:33:35.069018 IP shane-VirtualBox.53322 > www.xjtu.edu.cn.www: Flags [P.], seq 1:327, ack 1, win 5840, length 326
20:33:35.069090 IP shane-VirtualBox.53320 > www.xjtu.edu.cn.www: Flags [P.], seq 1:306, ack 1, win 5840, length 305
20:33:35.069165 IP shane-VirtualBox.53321 > www.xjtu.edu.cn.www: Flags [P.], seq 1:304, ack 1, win 5840, length 303
20:33:35.069232 IP shane-VirtualBox.53319 > www.xjtu.edu.cn.www: Flags [P.], seq 1:288, ack 1, win 5840, length 287
20:33:35.069771 IP www.xjtu.edu.cn.www > shane-VirtualBox.53318: Flags [.], ack 275, win 65535, length 0
20:33:35.069784 IP www.xjtu.edu.cn.www > shane-VirtualBox.53322: Flags [.], ack 327, win 65535, length 0
20:33:35.069883 IP www.xjtu.edu.cn.www > shane-VirtualBox.53320: Flags [.], ack 306, win 65535, length 0
20:33:35.069888 IP www.xjtu.edu.cn.www > shane-VirtualBox.53321: Flags [.], ack 304, win 65535, length 0
20:33:35.069890 IP www.xjtu.edu.cn.www > shane-VirtualBox.53319: Flags [.], ack 288, win 65535, length 0
20:33:35.084062 IP www.xjtu.edu.cn.www > shane-VirtualBox.53323: Flags [S.], seq 92672001, ack 3185278958, win 65535, options [mss 1460], length 0
20:33:35.084087 IP shane-VirtualBox.53323 > www.xjtu.edu.cn.www: Flags [.], ack 1, win 5840, length 0
20:33:35.084121 IP www.xjtu.edu.cn.www > shane-VirtualBox.53322: Flags [.], seq 1:1421, ack 327, win 65535, length 1420
20:33:35.084127 IP shane-VirtualBox.53322 > www.xjtu.edu.cn.www: Flags [.], ack 1421, win 8520, length 0
20:33:35.084146 IP www.xjtu.edu.cn.www > shane-VirtualBox.53322: Flags [.], seq 1421:2841, ack 327, win 65535, length 1420
20:33:35.084150 IP shane-VirtualBox.53322 > www.xjtu.edu.cn.www: Flags [.], ack 2841, win 11360, length 0
20:33:35.084168 IP www.xjtu.edu.cn.www > shane-VirtualBox.53320: Flags [.], seq 1:1421, ack 306, win 65535, length 1420
20:33:35.084172 IP shane-VirtualBox.53320 > www.xjtu.edu.cn.www: Flags [.], ack 1421, win 8520, length 0
20:33:35.084189 IP www.xjtu.edu.cn.www > shane-VirtualBox.53320: Flags [P.], seq 1421:1461, ack 306, win 65535, length 40
20:33:35.084194 IP shane-VirtualBox.53320 > www.xjtu.edu.cn.www: Flags [.], ack 1461, win 8520, length 0
20:33:35.084211 IP www.xjtu.edu.cn.www > shane-VirtualBox.53324: Flags [S.], seq 92736001, ack 2410941024, win 65535, options [mss 1460], length 0
20:33:35.084217 IP shane-VirtualBox.53324 > www.xjtu.edu.cn.www: Flags [.], ack 1, win 5840, length 0
20:33:35.084487 IP www.xjtu.edu.cn.www > shane-VirtualBox.53320: Flags [.], seq 1461:2881, ack 306, win 65535, length 1420
20:33:35.084493 IP shane-VirtualBox.53320 > www.xjtu.edu.cn.www: Flags [.], ack 2881, win 11360, length 0
20:33:35.084513 IP www.xjtu.edu.cn.www > shane-VirtualBox.53322: Flags [P.], seq 2841:2921, ack 327, win 65535, length 80
20:33:35.084517 IP shane-VirtualBox.53322 > www.xjtu.edu.cn.www: Flags [.], ack 2921, win 11360, length 0
20:33:35.084852 IP shane-VirtualBox.53324 > www.xjtu.edu.cn.www: Flags [P.], seq 1:327, ack 1, win 5840, length 326
20:33:35.084933 IP shane-VirtualBox.53323 > www.xjtu.edu.cn.www: Flags [P.], seq 1:327, ack 1, win 5840, length 326
20:33:35.085672 IP www.xjtu.edu.cn.www > shane-VirtualBox.53320: Flags [P.], seq 2881:2921, ack 306, win 65535, length 40
20:33:35.085685 IP www.xjtu.edu.cn.www > shane-VirtualBox.53320: Flags [.], seq 2921:4341, ack 306, win 65535, length 1420
20:33:35.085691 IP shane-VirtualBox.53320 > www.xjtu.edu.cn.www: Flags [.], ack 4341, win 14200, length 0
20:33:35.085771 IP www.xjtu.edu.cn.www > shane-VirtualBox.53320: Flags [.], seq 4341:5761, ack 306, win 65535, length 1420
20:33:35.085776 IP shane-VirtualBox.53320 > www.xjtu.edu.cn.www: Flags [.], ack 5761, win 17040, length 0
20:33:35.085831 IP www.xjtu.edu.cn.www > shane-VirtualBox.53320: Flags [.], seq 5761:7181, ack 306, win 65535, length 1420
20:33:35.085838 IP shane-VirtualBox.53320 > www.xjtu.edu.cn.www: Flags [.], ack 7181, win 19880, length 0
20:33:35.085892 IP www.xjtu.edu.cn.www > shane-VirtualBox.53320: Flags [P.], seq 7181:7301, ack 306, win 65535, length 120
20:33:35.085913 IP www.xjtu.edu.cn.www > shane-VirtualBox.53324: Flags [.], ack 327, win 65535, length 0
20:33:35.085918 IP www.xjtu.edu.cn.www > shane-VirtualBox.53323: Flags [.], ack 327, win 65535, length 0
20:33:35.086041 IP shane-VirtualBox.53320 > www.xjtu.edu.cn.www: Flags [.], ack 7301, win 19880, length 0
20:33:35.086497 IP www.xjtu.edu.cn.www > shane-VirtualBox.53320: Flags [.], seq 7301:8721, ack 306, win 65535, length 1420
20:33:35.086508 IP shane-VirtualBox.53320 > www.xjtu.edu.cn.www: Flags [.], ack 8721, win 22720, length 0
20:33:35.086533 IP www.xjtu.edu.cn.www > shane-VirtualBox.53320: Flags [.], seq 8721:10141, ack 306, win 65535, length 1420
20:33:35.086538 IP shane-VirtualBox.53320 > www.xjtu.edu.cn.www: Flags [.], ack 10141, win 25560, length 0
20:33:35.086556 IP www.xjtu.edu.cn.www > shane-VirtualBox.53320: Flags [.], seq 10141:11561, ack 306, win 65535, length 1420
20:33:35.086560 IP shane-VirtualBox.53320 > www.xjtu.edu.cn.www: Flags [.], ack 11561, win 28400, length 0
20:33:35.086578 IP www.xjtu.edu.cn.www > shane-VirtualBox.53320: Flags [.], seq 11561:12981, ack 306, win 65535, length 1420
20:33:35.086581 IP shane-VirtualBox.53320 > www.xjtu.edu.cn.www: Flags [.], ack 12981, win 31240, length 0
20:33:35.086599 IP www.xjtu.edu.cn.www > shane-VirtualBox.53320: Flags [.], seq 12981:14401, ack 306, win 65535, length 1420
20:33:35.086604 IP shane-VirtualBox.53320 > www.xjtu.edu.cn.www: Flags [.], ack 14401, win 34080, length 0
20:33:35.086620 IP www.xjtu.edu.cn.www > shane-VirtualBox.53320: Flags [P.], seq 14401:14876, ack 306, win 65535, length 475
20:33:35.086624 IP shane-VirtualBox.53320 > www.xjtu.edu.cn.www: Flags [.], ack 14876, win 36920, length 0
20:33:35.086641 IP www.xjtu.edu.cn.www > shane-VirtualBox.53320: Flags [F.], seq 14876, ack 306, win 65535, length 0
20:33:35.086646 IP www.xjtu.edu.cn.www > shane-VirtualBox.53321: Flags [.], seq 1:1421, ack 304, win 65535, length 1420
20:33:35.086649 IP shane-VirtualBox.53321 > www.xjtu.edu.cn.www: Flags [.], ack 1421, win 8520, length 0
20:33:35.086667 IP www.xjtu.edu.cn.www > shane-VirtualBox.53321: Flags [.], seq 1421:2841, ack 304, win 65535, length 1420
20:33:35.086670 IP shane-VirtualBox.53321 > www.xjtu.edu.cn.www: Flags [.], ack 2841, win 11360, length 0
20:33:35.086788 IP www.xjtu.edu.cn.www > shane-VirtualBox.53321: Flags [.], seq 2841:4261, ack 304, win 65535, length 1420
20:33:35.086794 IP shane-VirtualBox.53321 > www.xjtu.edu.cn.www: Flags [.], ack 4261, win 14200, length 0
20:33:35.086812 IP www.xjtu.edu.cn.www > shane-VirtualBox.53321: Flags [P.], seq 4261:4381, ack 304, win 65535, length 120
20:33:35.086816 IP shane-VirtualBox.53321 > www.xjtu.edu.cn.www: Flags [.], ack 4381, win 14200, length 0
20:33:35.087171 IP shane-VirtualBox.53320 > www.xjtu.edu.cn.www: Flags [F.], seq 306, ack 14877, win 36920, length 0
20:33:35.087334 IP shane-VirtualBox.53325 > www.xjtu.edu.cn.www: Flags [S], seq 2309279436, win 5840, options [mss 1460,sackOK,TS val 608625 ecr 0,nop,wscale 5], length 0
20:33:35.087409 IP www.xjtu.edu.cn.www > shane-VirtualBox.53320: Flags [.], ack 307, win 65535, length 0
20:33:35.087475 IP shane-VirtualBox.53326 > www.xjtu.edu.cn.www: Flags [S], seq 2938443032, win 5840, options [mss 1460,sackOK,TS val 608625 ecr 0,nop,wscale 5], length 0
20:33:35.087609 IP shane-VirtualBox.53327 > www.xjtu.edu.cn.www: Flags [S], seq 2406551112, win 5840, options [mss 1460,sackOK,TS val 608626 ecr 0,nop,wscale 5], length 0
20:33:35.089687 IP www.xjtu.edu.cn.www > shane-VirtualBox.53321: Flags [P.], seq 4381:5170, ack 304, win 65535, length 789
20:33:35.089703 IP shane-VirtualBox.53321 > www.xjtu.edu.cn.www: Flags [.], ack 5170, win 17040, length 0
20:33:35.089793 IP www.xjtu.edu.cn.www > shane-VirtualBox.53321: Flags [F.], seq 5170, ack 304, win 65535, length 0
20:33:35.089800 IP www.xjtu.edu.cn.www > shane-VirtualBox.53319: Flags [P.], seq 1:406, ack 288, win 65535, length 405
20:33:35.089805 IP shane-VirtualBox.53319 > www.xjtu.edu.cn.www: Flags [.], ack 406, win 6432, length 0
20:33:35.089829 IP www.xjtu.edu.cn.www > shane-VirtualBox.53319: Flags [F.], seq 406, ack 288, win 65535, length 0
20:33:35.090067 IP shane-VirtualBox.53321 > www.xjtu.edu.cn.www: Flags [F.], seq 304, ack 5171, win 17040, length 0
20:33:35.090169 IP shane-VirtualBox.53319 > www.xjtu.edu.cn.www: Flags [F.], seq 288, ack 407, win 6432, length 0
20:33:35.090290 IP shane-VirtualBox.53328 > www.xjtu.edu.cn.www: Flags [S], seq 325929839, win 5840, options [mss 1460,sackOK,TS val 608626 ecr 0,nop,wscale 5], length 0
20:33:35.090695 IP www.xjtu.edu.cn.www > shane-VirtualBox.53321: Flags [.], ack 305, win 65535, length 0
20:33:35.090708 IP www.xjtu.edu.cn.www > shane-VirtualBox.53319: Flags [.], ack 289, win 65535, length 0
20:33:35.091941 IP www.xjtu.edu.cn.www > shane-VirtualBox.53322: Flags [.], seq 2921:4341, ack 327, win 65535, length 1420
20:33:35.091960 IP shane-VirtualBox.53322 > www.xjtu.edu.cn.www: Flags [.], ack 4341, win 14200, length 0
20:33:35.091991 IP www.xjtu.edu.cn.www > shane-VirtualBox.53322: Flags [.], seq 4341:5761, ack 327, win 65535, length 1420
20:33:35.091995 IP shane-VirtualBox.53322 > www.xjtu.edu.cn.www: Flags [.], ack 5761, win 17040, length 0
20:33:35.092128 IP www.xjtu.edu.cn.www > shane-VirtualBox.53322: Flags [.], seq 5761:7181, ack 327, win 65535, length 1420
20:33:35.092136 IP shane-VirtualBox.53322 > www.xjtu.edu.cn.www: Flags [.], ack 7181, win 19880, length 0
20:33:35.092155 IP www.xjtu.edu.cn.www > shane-VirtualBox.53322: Flags [P.], seq 7181:7301, ack 327, win 65535, length 120
20:33:35.092160 IP www.xjtu.edu.cn.www > shane-VirtualBox.53324: Flags [.], seq 1:1421, ack 327, win 65535, length 1420
20:33:35.092163 IP shane-VirtualBox.53324 > www.xjtu.edu.cn.www: Flags [.], ack 1421, win 8520, length 0
20:33:35.092181 IP www.xjtu.edu.cn.www > shane-VirtualBox.53324: Flags [.], seq 1421:2841, ack 327, win 65535, length 1420
20:33:35.092185 IP shane-VirtualBox.53324 > www.xjtu.edu.cn.www: Flags [.], ack 2841, win 11360, length 0
20:33:35.092325 IP shane-VirtualBox.53322 > www.xjtu.edu.cn.www: Flags [.], ack 7301, win 19880, length 0
20:33:35.094360 IP www.xjtu.edu.cn.www > shane-VirtualBox.53323: Flags [.], seq 1:1421, ack 327, win 65535, length 1420
20:33:35.094379 IP shane-VirtualBox.53323 > www.xjtu.edu.cn.www: Flags [.], ack 1421, win 8520, length 0
20:33:35.094408 IP www.xjtu.edu.cn.www > shane-VirtualBox.53323: Flags [P.], seq 1421:1461, ack 327, win 65535, length 40
20:33:35.094412 IP shane-VirtualBox.53323 > www.xjtu.edu.cn.www: Flags [.], ack 1461, win 8520, length 0
20:33:35.094430 IP www.xjtu.edu.cn.www > shane-VirtualBox.53324: Flags [P.], seq 2841:2921, ack 327, win 65535, length 80
20:33:35.094434 IP shane-VirtualBox.53324 > www.xjtu.edu.cn.www: Flags [.], ack 2921, win 11360, length 0
20:33:35.107433 IP shane-VirtualBox.53329 > www.xjtu.edu.cn.www: Flags [S], seq 953449121, win 5840, options [mss 1460,sackOK,TS val 608630 ecr 0,nop,wscale 5], length 0
20:33:35.118431 IP www.xjtu.edu.cn.www > shane-VirtualBox.53323: Flags [.], seq 1461:2881, ack 327, win 65535, length 1420
20:33:35.118482 IP shane-VirtualBox.53323 > www.xjtu.edu.cn.www: Flags [.], ack 2881, win 11360, length 0
20:33:35.118545 IP www.xjtu.edu.cn.www > shane-VirtualBox.53323: Flags [.], seq 2881:4301, ack 327, win 65535, length 1420
20:33:35.118567 IP shane-VirtualBox.53323 > www.xjtu.edu.cn.www: Flags [.], ack 4301, win 14200, length 0
20:33:35.118608 IP www.xjtu.edu.cn.www > shane-VirtualBox.53323: Flags [.], seq 4301:5721, ack 327, win 65535, length 1420
20:33:35.118628 IP shane-VirtualBox.53323 > www.xjtu.edu.cn.www: Flags [.], ack 5721, win 17040, length 0
20:33:35.118786 IP www.xjtu.edu.cn.www > shane-VirtualBox.53323: Flags [P.], seq 5721:5841, ack 327, win 65535, length 120
20:33:35.118802 IP www.xjtu.edu.cn.www > shane-VirtualBox.53323: Flags [.], seq 5841:7261, ack 327, win 65535, length 1420
20:33:35.118815 IP shane-VirtualBox.53323 > www.xjtu.edu.cn.www: Flags [.], ack 7261, win 19880, length 0
20:33:35.118859 IP www.xjtu.edu.cn.www > shane-VirtualBox.53323: Flags [.], seq 7261:8681, ack 327, win 65535, length 1420
20:33:35.118872 IP shane-VirtualBox.53323 > www.xjtu.edu.cn.www: Flags [.], ack 8681, win 22720, length 0
20:33:35.118991 IP www.xjtu.edu.cn.www > shane-VirtualBox.53323: Flags [.], seq 8681:10101, ack 327, win 65535, length 1420
20:33:35.119002 IP shane-VirtualBox.53323 > www.xjtu.edu.cn.www: Flags [.], ack 10101, win 25560, length 0
20:33:35.119029 IP www.xjtu.edu.cn.www > shane-VirtualBox.53323: Flags [.], seq 10101:11521, ack 327, win 65535, length 1420
20:33:35.119040 IP shane-VirtualBox.53323 > www.xjtu.edu.cn.www: Flags [.], ack 11521, win 28400, length 0
20:33:35.119152 IP www.xjtu.edu.cn.www > shane-VirtualBox.53323: Flags [.], seq 11521:12941, ack 327, win 65535, length 1420
20:33:35.119162 IP shane-VirtualBox.53323 > www.xjtu.edu.cn.www: Flags [.], ack 12941, win 31240, length 0
20:33:35.119194 IP www.xjtu.edu.cn.www > shane-VirtualBox.53323: Flags [P.], seq 12941:13141, ack 327, win 65535, length 200
20:33:35.119203 IP shane-VirtualBox.53323 > www.xjtu.edu.cn.www: Flags [.], ack 13141, win 34080, length 0
20:33:35.121165 IP www.xjtu.edu.cn.www > shane-VirtualBox.53323: Flags [.], seq 13141:14561, ack 327, win 65535, length 1420
20:33:35.121179 IP shane-VirtualBox.53323 > www.xjtu.edu.cn.www: Flags [.], ack 14561, win 36920, length 0
20:33:35.121301 IP www.xjtu.edu.cn.www > shane-VirtualBox.53323: Flags [.], seq 14561:15981, ack 327, win 65535, length 1420
20:33:35.121306 IP shane-VirtualBox.53323 > www.xjtu.edu.cn.www: Flags [.], ack 15981, win 39760, length 0
20:33:35.121325 IP www.xjtu.edu.cn.www > shane-VirtualBox.53323: Flags [.], seq 15981:17401, ack 327, win 65535, length 1420
20:33:35.121329 IP shane-VirtualBox.53323 > www.xjtu.edu.cn.www: Flags [.], ack 17401, win 42600, length 0
20:33:35.121448 IP www.xjtu.edu.cn.www > shane-VirtualBox.53323: Flags [.], seq 17401:18821, ack 327, win 65535, length 1420
20:33:35.121455 IP shane-VirtualBox.53323 > www.xjtu.edu.cn.www: Flags [.], ack 18821, win 45440, length 0
20:33:35.121475 IP www.xjtu.edu.cn.www > shane-VirtualBox.53323: Flags [.], seq 18821:20241, ack 327, win 65535, length 1420
20:33:35.121478 IP shane-VirtualBox.53323 > www.xjtu.edu.cn.www: Flags [.], ack 20241, win 48280, length 0
20:33:35.121597 IP www.xjtu.edu.cn.www > shane-VirtualBox.53323: Flags [.], seq 20241:21661, ack 327, win 65535, length 1420
20:33:35.121602 IP shane-VirtualBox.53323 > www.xjtu.edu.cn.www: Flags [.], ack 21661, win 51120, length 0
20:33:35.121623 IP www.xjtu.edu.cn.www > shane-VirtualBox.53323: Flags [P.], seq 21661:21901, ack 327, win 65535, length 240
20:33:35.121626 IP shane-VirtualBox.53323 > www.xjtu.edu.cn.www: Flags [.], ack 21901, win 53960, length 0
20:33:35.123927 IP www.xjtu.edu.cn.www > shane-VirtualBox.53323: Flags [.], seq 21901:23321, ack 327, win 65535, length 1420
20:33:35.123938 IP shane-VirtualBox.53323 > www.xjtu.edu.cn.www: Flags [.], ack 23321, win 58220, length 0
20:33:35.123990 IP www.xjtu.edu.cn.www > shane-VirtualBox.53323: Flags [.], seq 23321:24741, ack 327, win 65535, length 1420
20:33:35.123996 IP shane-VirtualBox.53323 > www.xjtu.edu.cn.www: Flags [.], ack 24741, win 61060, length 0
20:33:35.124015 IP www.xjtu.edu.cn.www > shane-VirtualBox.53323: Flags [.], seq 24741:26161, ack 327, win 65535, length 1420
20:33:35.124019 IP shane-VirtualBox.53323 > www.xjtu.edu.cn.www: Flags [.], ack 26161, win 61060, length 0
20:33:35.124039 IP www.xjtu.edu.cn.www > shane-VirtualBox.53323: Flags [.], seq 26161:27581, ack 327, win 65535, length 1420
20:33:35.124043 IP www.xjtu.edu.cn.www > shane-VirtualBox.53323: Flags [P.], seq 27581:27741, ack 327, win 65535, length 160
20:33:35.124096 IP shane-VirtualBox.53323 > www.xjtu.edu.cn.www: Flags [.], ack 27741, win 63900, length 0
20:33:35.126995 IP www.xjtu.edu.cn.www > shane-VirtualBox.53323: Flags [.], seq 27741:29161, ack 327, win 65535, length 1420
20:33:35.127052 IP www.xjtu.edu.cn.www > shane-VirtualBox.53323: Flags [P.], seq 29161:29439, ack 327, win 65535, length 278
20:33:35.127097 IP www.xjtu.edu.cn.www > shane-VirtualBox.53323: Flags [F.], seq 29439, ack 327, win 65535, length 0
20:33:35.127105 IP www.xjtu.edu.cn.www > shane-VirtualBox.53327: Flags [S.], seq 92800001, ack 2406551113, win 65535, options [mss 1460], length 0
20:33:35.127118 IP shane-VirtualBox.53327 > www.xjtu.edu.cn.www: Flags [.], ack 1, win 5840, length 0
20:33:35.127177 IP www.xjtu.edu.cn.www > shane-VirtualBox.53326: Flags [S.], seq 92864001, ack 2938443033, win 65535, options [mss 1460], length 0
20:33:35.127220 IP shane-VirtualBox.53326 > www.xjtu.edu.cn.www: Flags [.], ack 1, win 5840, length 0
20:33:35.127353 IP www.xjtu.edu.cn.www > shane-VirtualBox.53325: Flags [S.], seq 92928001, ack 2309279437, win 65535, options [mss 1460], length 0
20:33:35.127363 IP shane-VirtualBox.53325 > www.xjtu.edu.cn.www: Flags [.], ack 1, win 5840, length 0
20:33:35.127421 IP www.xjtu.edu.cn.www > shane-VirtualBox.53322: Flags [.], seq 7301:8721, ack 327, win 65535, length 1420
